"Bid";"Author";"Year";"Title corrected";"General category";"Keywords";"Typology";"Period";"Subjects"
"VEA0072585";;1994;"{Dispacci.} 17: 30 giugno 1739- 24 agosto 1751";"history";"politics";"primary";"xviii";"AMBASCIATORI VENETI - Napoli - Relazioni - 1739-1751; VENEZIA <REPUBBLICA> E REGNO DI NAPOLI - Relazioni diplomatiche - 1739-1751 - Fonti archivistiche; Ambasciatori veneti - Relazioni - Napoli; Venezia - ambasciatori - relazioni; XVIII"
"TSA0040998";"Fersuoch, Lidia";1995;"S. Leonardo in Fossa Mala e altre fondazioni medievali lagunari : restituzione territoriale, storica e archeologica";"architecture";"archeology; churches";;"middle ages";"STORIA DI VENEZIA (PROV.); MEDIOEVO; LAGUNA DI VENEZIA - Monastero di San Leonardo - Ritrovamenti archeologici; LAGUNA - Monastero di San Leonardo - Ritrovamenti archeologici; Architettura monastica; Venezia <Repubblica> - Laguna - Sec. 14.; Archeologia medievale - Venezia ; XII-XIV"
"VEA0072255";"Manno, Antonio";1995;"Basilica dei Santi Giovanni e Paolo : arte e devozione";"architecture";"churches";;;"ARCHITETTURA DELLE CHIESE CRISTIANE. Venezia; VENEZIA - Chiesa dei Santi Giovanni e Paolo; CHIESA DEI SANTI GIOVANNI E PAOLO; Venezia-chiese"
"VEA0074646";"Moretti, Lino";1995;"Chiesa di Santa Maria dei Carmini : arte e devozione";"architecture";"churches";;;"Architettura di edifici per chiese cristiane. Venezia provincia.; VENEZIA - Chiesa di Santa Maria dei Carmini; CHIESA DI SANTA MARIA DEI CARMINI; Venezia-chiese"
"TO00342250";"Tigler, Guido";1995;"Il portale maggiore di San Marco a Venezia : aspetti iconografici e stilistici dei rilievi duecenteschi";"arts";"churches";;;"ARCHITETTURA DELLE CHIESE CRISTIANE. VENEZIA; VENEZIA - Chiesa di San Marco - Portali; CHIESA DI SAN MARCO - Portali; Basilica di San Marco - Portale maggiore - Venezia; Venezia - Chiese - San Marco - Portali; Arte - Venezia ; XIII"
"VEA0075754";"Concina, Ennio";1995;"Le chiese di Venezia : l'arte e la storia";"architecture";"churches; arts";;;"ARCHITETTURA DELLE CHIESE CRISTIANE. Venezia; VENEZIA - Chiese; CHIESE"
"VEA0074632";"Berveglieri, Roberto";1995;"Inventori stranieri a Venezia, 1474-1788 : importazione di tecnologia e circolazione di tecnici artigiani inventori : repertorio";"history";"crafts";;"renaissance; xvii; xviii";"INVENZIONI E BREVETTI. TRATTAMENTO STORICO E GEOGRAFICO; INVENZIONI - Venezia - Sec. 15.-18.; ARTIGIANI - Venezia - Sec. 15.-18.; INVENTORI STRANIERI - Sec. 15.-18.; Storia del diritto 95; Storia veneta; Inventori; Diritto industriale. Storia; Storia del diritto industriale; Tecnologia. Storia; Invenzioni - Venezia ; XV-XVIII"
"LO10358855";"Campolieti, Giuseppe";1995;"Marin Faliero : il doge decapitato";"history";"individuals";;"middle ages";"; FALIERO, MARINO; FALIERO, MARINO"
"VEA0077516";"Talbot, Michael";1995;"The sacred vocal music of Antonio Vivaldi";"arts";"individuals; music";;"xviii";"FORME VOCALI SACRE. Persone; MUSICA SACRA; VIVALDI, ANTONIO; MUSICA SACRA - Venezia - Sec. 17.-18.; VIVALDI, ANTONIO; Vivaldi, Antonio <1678-1741.>; Venezia - musica; XVII-XVIII"
"VEA0068371";"a cura di Giorgio Busetto";1995;"Pietro Longhi, Gabriel Bella : scene di vita veneziana";"arts";"individuals; painting";"catalogue";"xviii";"Pittura. Italia; BELLA, GABRIELE; BELLA, GABRIELE; BELLA, GABRIELE - Esposizioni - Venezia - 1995; LONGHI, PIETRO - Esposizioni - Venezia - 1995; LONGHI, PIETRO; Longhi, Pietro <1702-1785>; Esposizioni - Venezia - 1995; Venezia - pittura; XVIII"
"VEA0070933";"a cura di Renata Segre";1995;"Gli ebrei a Venezia, 1938-1945: una comunità tra persecuzione e rinascita";"history";"jews";"catalogue";"recent";"Storia di venezia. Ebrei; COMUNITA ISRAELITICHE; EBREI - Venezia - 1938-1945 - Esposizioni - Venezia - 1995; ESPOSIZIONI - Venezia e Mestre - ""Gli ebrei a Venezia 1938-1945"" - 1995; FONDAZIONE SCIENTIFICA QUERINI STAMPALIA - Esposizioni - ""Gli ebrei a Venezia 1938-1945"" - 1995; EBREI - 1938-1945; VENEZIA - Esposizioni - 1995; MESTRE <VENEZIA> - Esposizioni - 1995; Ebrei - Venezia; Ebrei - Venezia - Sec. 20; Ebrei - Venezia ; XX"
"PUV0259190";"Arbel, Benjamin";1995;"Trading nations : Jews and Venetians in the early modern eastern Mediterranean";"history";"jews; empire";;"renaissance; xvii; xviii";"GRUPPI RAZZIALI, ETNICI, NAZIONALI; EBREI - Venezia - Sec. 16.; EBREI - Sec. 16.; Ebrei e veneziani - Relazioni economiche - Sec-XVI; Ebrei - Regione mediterranea - Storia; Ebrei - Venezia; XVI"
"VIA0052610";"edizione critica a cura di Eugenio Burgio";1995;"Legenda de misier sento Alban : volgarizzamento veneziano in prosa del 14. secolo";"history";"literature";;"middle ages";"LETTERATURA POPOLARE; VENEZIA - Museo Correr - Biblioteca - Ms. Correr 1497; PASSIO ALBANI - Volgarizzamenti veneziani; MUSEO CORRER - Ms Correr 1497; ALBANO <SANTO>; GIUSTINO DI GHERARDINO; MANOSCRITTI MINIATI - Sec. 14. - Venezia - Museo Correr; Venezia - Museo Correr - Manoscritti - Ms. Correr 1497"
"VEA0075584";"Stöckly, Doris";1995;"Le système de l'Incanto des galées du marché à Venise (fin 13.e-milieu 15.e siècle";"history";"maritime; commerce";;"middle ages; renaissance";"Trasporti marittimi. Provincia di Venezia.; COMMERCIO MARITTIMO - Venezia <Repubblica> - Sec. 13.-15.; COMMERCIO MARITTIMO - Sec. 13.-15.; Venezia - Commercio - Sec. 13.-15.; Commercio - Venezia; XIII-XV"
"REA0034965";;1995;"Splendori del Settecento veneziano";"arts";"painting";"catalogue";"xviii";"PITTURA. Venezia; PITTURA VENEZIANA - Sec. 18. - Esposizioni - Venezia - 1995; PITTURA - Sec. 18.; Esposizioni - Venezia - 1995; Arte - Venezia; XVIII"
"VEA0079994";"testi di Francesco Amendolagine ... \et al";1995;"Palazzo Bonfadini-Vivante";"architecture";"palaces";;;"ARCHITETTURA DI EDIFICI PUBBLICI. SEDI DI ORGANI LOCALI E MUNICIPALI. Venezia; VENEZIA - Palazzo Bonfadini-Vivante; PALAZZO BONFADINI-VIVANTE; Palazzi - Venezia"
"VEA0076209";"Viallon, Marie F";1995;"Venise et la porte ottomane (1453-1566) : un siecle de relations veneto-ottomanes de la prise de Constantinople a la mort de Soliman";"history";"politics";;"renaissance";"STORIA DI VENEZIA (PROV.); VENEZIA <REPUBBLICA> E IMPERO OTTOMANO - Sec. 15.-16.; RELAZIONI CON L'IMPERO OTTOMANO - 1453-1566; Venezia - Relazioni con la Turchia - 1453-1471"
"MIL0293612";"Cadel, Anna Maria";1995;"Venezia e la Massoneria nel Settecento";"history";"social";;"xviii";"MASSONERIA - Venezia <Repubblica> - Sec. 18.; VENEZIA <REPUBBLICA> - Massoneria - Sec.18.; Massoneria - Venezia - Sec. 17; Società segrete - Venezia ; XVIII"
"CFI0310243";"Giuseppetti, Raffaella";1995;"Un castello in Laguna : storia dei molini Stucky";"architecture";"urban";;"xix; recent";"Edifici industriali; VENEZIA - Mulino Stucky; MULINO STUCKY; Venezia - Molino Stucky - Storia"
"VEA0078079";"Zucchetta, Gianpietro";1995;"Un'altra Venezia : immagini e storia degli antichi canali scomparsi";"architecture";"urban";;"xviii; xix";"Canali. Ingegneria idraulica. Venezia.; Venezia - Canali; CANALI; Venezia - Canali - Sistemazione - Sec. 18.-19."
"VEA0080252";"Crouzet-Pavan, Élisabeth";1995;"La mort lente de Torcello : histoire d'une cité disparue";"history";"urban";;;"STORIA. VENEZIA (PROV.); TORCELLO <VENEZIA>; TORCELLO <VENEZIA> - Storia; TORCELLO - Storia"
"RAV0253911";"McAndrew, John";1995;"L'architettura veneziana del primo Rinascimento";"architecture";;;"renaissance";"ARCHITETTURA. Venezia; ARCHITETTURA - Venezia - Sec. 15.-16.; ARCHITETTURA - Sec. 15.-16.; Architettura - Venezia ; XV"
"UBO0242238";"Venezia";1995;"I patti con Imola : 1099-1422";"history";"politics";"primary";"middle ages";"ACCORDI COMMERCIALI. TRATTAMENTO STORICO E GEOGRAFICO; VENEZIA <REPUBBLICA> - Relazioni diplomatiche - 1099-1422 - Fonti; VENEZIA <REPUBBLICA> - Relazioni con Imola - 1099-1422 - Documenti; Venezia - Relazioni internazionali - Imola - 1099-1422; Trattati - Venezia ; XI-XV"
"BVE0094713";"edited by J. Chrysostomides";1995;"Monumenta Peloponnesiaca : documents for the history of the Peloponnese in the 14. and 15. centuries";"history";"empire";"primary";"middle ages; renaissance";"Storia della Grecia. Peloponneso e istmo di Corinto.; PELOPONNESO - Storia - Sec. 14.-15. - Fonti; Peloponneso - Storia - Sec. 14.-15.; Storia - Fonti ; XIV-XV"
"PUV0278042";"Chiari Moretto Wiel, Maria Agnese";1996;"Chiesa di Santo Stefano : arte e devozione";"architecture";"churches";;;"ARCHITETTURA DELLE CHIESE CRISTIANE. Venezia; CHIESA DI SANTO STEFANO; VENEZIA - Chiesa di Santo Stefano; Venezia-chiese"
"VEA0094289";"Fusaro, Maria";1996;"Uva passa : una guerra commerciale tra Venezia e l'Inghilterra, 1540-1640";"history";"commerce";;"renaissance; xvii";"COMMERCIO INTERNAZIONALE. Prodotti della viticoltura; VENEZIA <REPUBBLICA> E INGHILTERRA - Relazioni economiche e commerciali - Sec. 16.-17.; UVA SECCA - Commercio - Sec. 16.-17.; UVE PASSE - Commercio - 1540-1640; Venezia <Repubblica> e Inghilterra - Relazioni commerciali - 1540-1640; Commercio - Venezia(Repubblica); XVI-XVII"
"VIA0060662";"Frank, Martina";1996;"Virtù e fortuna : il mecenatismo e le committenze artistiche della famiglia Manin tra Friuli e Venezia nel 17. e 18. secolo";"arts";"elites; collecting";;"xvii; xviii";"BELLE ARTI E ARTI DECORATIVE. ITALIA; MANIN <FAMIGLIA> - Mecenatismo - Sec. 17.-18.; MANIN <FAMIGLIA>; Manin(Famiglia) ; XVII-XVIII"
"VEA0093230";"Domzalski, Oliver Thomas";1996;"Politische Karrieren und Machtverteilung im venezianischen Adel: (1646-1797";"history";"elites; government";;"xvii; xviii";"NOBILTA - 1646-1797; NOBILTA - Venezia <Repubblica> - Carriera - 1646-1797; VENEZIA <REPUBBLICA> - Magistrature - 1646-1797; MAGISTRATURE - Sec. 17.-18.; Politica - Venezia(Repubblica) ; XVI-XVII"
"BVE0100425";"Calò, Luca";1996;"Giulio Gherlandi heretico ostinatissimo : un predicatore eterodosso del Cinquecento tra il Veneto e la Moravia";"history";"individuals; religion";;"renaissance";"CONTROVERSIE DOTTRINALI ED ERESIE NELLA STORIA DELLA CHIESA. 6.-16. SECOLO. Persone; ERESIE - Venezia <Repubblica> - Sec. 16.; ERETICI; Gherlandi, Giulio - Eresia; Cultura - Venezia; XV"
"PUV0297906";"a cura di Piero Pazzi";1996;"L'oro di Venezia: oreficerie, argenti e gioielli di Venezia e delle città venete da collezioni private : Venezia, Biblioteca nazionale Marciana, 29 giugno - 6 ottobre 1996";"arts";"jewelry";"catalogue";"middle ages; renaissance; xvii; xviii; xix";"LAVORI ARTISTICI IN ARGENTO. Italia nordorientale; OREFICERIE VENEZIANE - Sec. 13.-19. - Esposizioni - Venezia - 1996; GIOIELLI - Venezia <Repubblica> - Sec. 13.-19. - Esposizioni - Venezia - 1996; GIOIELLI - Sec. 13.-19. - Esposizioni - Venezia - 1996; OREFICERIA - Sec. 13.-19. - Esposizioni - Venezia - 1996; VENEZIA - Esposizioni - 1996; Venezia - Oreficeria; Esposizioni - Venezia - 1996"
"VEA0085801";"Venezia";1996;"I trattati con Bisanzio, 1265-1285";"history";"politics";"primary";"middle ages";"; VENEZIA <REPUBBLICA> - Relazioni con l'Impero d'Oriente - 1265-1285 - Documenti; RELAZIONI CON L'IMPERO D'ORIENTE - 1265-1285 - Documenti; Venezia - Relazioni internazionali - Bisanzio; Venezia (repubblica) - Relazioni con l'Impero d'Oriente - Sec. 11.-12.; Venezia(Repubblica) - Rapporti [con l']Oriente"
"VEA0082551";"2: 1205-1227";1996;"Gli atti originali della Cancelleria veneziana";"history";"politics";"primary";"middle ages";"VENEZIA <REPUBBLICA> - Cancelleria - Documenti - 1205-1227; Venezia (repubblica) - documenti; XIII"
"LO10427656";"Crescenzi, Victor";1996;"Esse de Maiori Consilio : legittimità civile e legittimazione politica nella Repubblica di Venezia, secc. 13.-16";"history";"politics";;"middle ages; renaissance";"; LEGITTIMAZIONE - Venezia <repubblica> - Sec. 13.-16.; LEGITTIMAZIONI <DIRITTO CIVILE>; NOBILI - Diritto - Venezia <Repubblica> - Sec. 13.-16.; Venezia (Repubblica) - Classe dirigente - Sec. 13.-16.; Diritto - Venezia(Repubblica); XIII-XVI"
"VEA0099296";1;1996;"Dispacci da Costantinopoli di Ferigo Foscari, 1792-1796";"history";"politics";"primary";"xviii";"Ambasciatori veneti - Relazioni - Costantinopoli"
"VEA0083327";"Casini, Matteo";1996;"I gesti del principe : la festa politica a Firenze e Venezia in età rinascimentale";"history";"politics; entertainment";;"renaissance";"USI E COSTUMI IN OCCASIONI PARTICOLARI. FESTIVITA. Firenze; FESTE; FESTE PUBBLICHE - Venezia - Sec. 15.-16.; FESTE PUBBLICHE - Firenze - Sec. 15.-16.; VENEZIA - Feste pubbliche - Sec. 15.-16.; SCENOGRAFIA - Firenze - Sec. 15.-16.; SCENOGRAFIA - Venezia - Sec. 15.-16.; Rinascimento - Italia - Firenze - Venezia"
"TO00746027";"Logan, Oliver";1996;"The Venetian upper clergy in the 16th and early 17th centuries : a study in religious culture";"history";"religion; government";;"renaissance; xvii";"Clero - Italia - Sec. 16.-17; Venezia - chiesa; XVI-XVII"
"MIL0303565";"Pedani, Maria Pia";1996;"Veneta auctoritate notarius : storia del notariato veneziano, 1514-1797";"history";"social; government";;"renaissance; xvii; xviii";"Diritto processuale civile e tribunali civili. Italia nordorientale. Regione del Veneto. Comune di Venezia.; TRIBUNALI CIVILI. ALTRI FUNZIONARI. Venezia (prov.); NOTARIATO - Venezia - Sec. 16.-18.; NOTARIATO - Sec. 16.-18.; Notariato - Venezia"
"VEA0097976";"Stolberg, Michael";1996;"Wolken uber der Serenissima : eine kleine Geschichte der Luftverschmutzung in Venedig";"history";"urban";;;"INQUINAMENTO ATMOSFERICO - Venezia; VENEZIA - Inquinamento atmosferico; INQUINAMENTO ATMOSFERICO; Venezia - Sviluppo economico - Storia; Inquinamento - Storia - Venezia"
"VEA0089926";"Distefano, Giovanni";1996;"Storia di Venezia, 1797-1997";"history";;;"xix; recent";"VENEZIA - Storia - 1798-1895; VENEZIA - Storia - 1797-1997; Storia - Venezia ; XIX"
"VEA0098436";"Bertoli, Bruno";1997;"Chiesa di San Salvador : arte e devozione";"architecture";"churches";;;"ARCHITETTURA DELLE CHIESE CRISTIANE. Venezia; CHIESA DI SAN SALVADOR; VENEZIA - Chiesa di San Salvador"
"VEA0095332";"a cura di Irene Favaretto, Giovanna Luisa Ravagnan";1997;"Lo statuario pubblico della Serenissima: due secoli di collezionismo di antichità, 1596-1797";"arts";"collecting";"catalogue";"renaissance; xvii; xviii";"; VENEZIA - Museo archeologico - Cataloghi; Biblioteca nazionale Marciana - Cataloghi; VENEZIA - Esposizioni - 1997; GRIMANI, DOMENICO - Donazione; GRIMANI <FAMIGLIA> - Collezioni d'arte; MUSEO ARCHEOLOGICO - Statue antiche; PALAZZO GRIMANI <SANTA MARIA FORMOSA>; MUSEO ARCHEOLOGICO - Cataloghi; STATUE ROMANE - Venezia - Esposizioni - Venezia - 1997; STATUE GRECHE - Venezia - Esposizioni - Venezia - 1997; GRIMANI, GIOVANNI - Donazione; Statuette; Collezionismo - Venezia(Repubblica); XVI-XVIII"
"VEA0097519";"Hunecke, Volker";1997;"Il patriziato veneziano alla fine della Repubblica : 1646-1797";"history";"elites; government";;"xvii; xviii";"NOBILTA. VENEZIA <PROV.>; NOBILTA - Venezia <Repubblica> - 1646-1797; NOBILTA - 1646-1797; Nobilta' - Venezia ; XVII-XVIII"
"VIA0061869";"Povolo, Claudio";1997;"L'intrigo dell'onore : poteri e istituzioni nella Repubblica di Venezia tra Cinque e Seicento";"history";"elites; government; politics";;"renaissance; xvii";"Italia. Provincia di Venezia. Dal 16. al 18. sec.; GIUSTIZIA PENALE; POTERE; GIUSTIZIA PENALE - Venezia <repubblica> - Sec. 16.-17.; POTERE - Venezia <repubblica> - Sec. 16.-17.; VENEZIA <REPUBBLICA> - Giustizia penale - Sec. 16.-17.; Venezia (Repubblica) - Istituzioni politiche - Storia; Organizzazioni istituzionali - Venezia ; XVI-XVII"
"PUV0337068";"Mueller, Reinhold C";1997;"Money and banking in medieval and Renaissance Venice";"history";"finance";;"renaissance";"BANCHE - Venezia <Repubblica> - Sec. 13.-16.; VENEZIA <REPUBBLICA> - Finanza - Sec. 13.-16.; FINANZA - Sec. 13.-16.; BANCHE - Sec. 13.-16.; Moneta - Venezia - Storia; Banche - Venezia - Storia ; XII-XVI"
"VIA0065243";"a cura di Paolo Preto, Filiberto Agostini e Giovanni Silvano";1997;"Proclami delle municipalità venete di terraferma 1797";"history";"mainland";;"xviii";"; Municipalità Venete <1797> - Proclami; Venezia - storia; XVIII"
"IEI0114618";"édition établie par Alessandro Fontana, Francesco Furlan et Georges Saro";1997;"Venise et la révolution française : les 470 dépêches des ambassadeurs de Venise au doge, 1786-1795";"history";"politics";"primary";"xviii";"STORIA DELLA FRANCIA. RIVOLUZIONE, 1789-1804; AMBASCIATORI - Relazioni; AMBASCIATORI VENETI - Francia - Relazioni - 1786-1795; AMBASCIATORI VENETI - RELAZIONI - SEC. 18.; Venezia - Rapporti [con la] Francia ; XVIII"
"VEA0095616";;1997;"Dai dogi agli imperatori: la fine della Repubblica tra storia e mito";"history";"politics; myth";"catalogue";"xviii";"STORIA DI VENEZIA. 1797-1815; VENEZIA - Esposizioni - 1997; VENEZIA - Storia - 1797-1814 - Esposizioni - Venezia - 1997; VENEZIA - Vita artistica e culturale - 1797-1814 - Fonti documentarie - Venezia - Esposizioni - 1997; VENEZIA - Museo Correr - Collezioni; STORIA - 1797-1814; VENEZIA - Esposizioni - 1997; Venezia - Storia ; XVIII"
"PUV0327562";"Pizzati, Anna";1997;"Commende e politica ecclesiastica nella Repubblica di Venezia tra '500 e '600";"history";"religion; government";;"renaissance; xvii";"ORGANIZZAZIONI E GRUPPI RELIGIOSI. VENETO; RELAZIONI DELLO STATO CON LE COLLETTIVITA RELIGIOSE; BENEFICI ECCLESIASTICI - Venezia <Repubblica> - Storia - Sec.16.-17.; VENEZIA <REPUBBLICA> - Relazioni con la Santa Sede - Storia - Sec.16.-17.; POLITICA ECCLESIASTICA - Sec. 16.-17.; Venezia <Repubblica> - Politica ecclesiastica - Sec. 16.-17."
"VEA0094566";"Imhaus, Brunehilde";1997;"Le minoranze orientali a Venezia, 1300-1510";"history";"social";;"middle ages; renaissance";"GRUPPI RAZZIALI, ETNICI, NAZIONALI. Venezia; VENEZIA <REPUBBLICA> - Minoranze etniche - Sec. 14.-16.; VENEZIA <REPUBBLICA> - Immigrazione - Sec. 14.-16.; IMMIGRAZIONE - Sec. 14.-16.; VENEZIA <REPUBBLICA> - Vita sociale - 1300-1510; Venezia - Minoranze - Sec.14.-15; Minoranze etniche - Venezia (Repubblica) - Sec. 14.-15.; Minoranze etniche - Venezia ; XIV-XVI"
"MIL0333219";"Davis, Robert C";1997;"La guerra dei pugni : cultura popolare e violenza pubblica a Venezia nel tardo Rinascimento";"history";"social";;"renaissance";"STORIA DI VENEZIA. 1607-1718; VENEZIA - Storia - Sec. 16.; VENEZIA - Gioco dei pugni; GIUOCHI POPOLARI - Sec. 16.; Venezia (Repubblica) - Cultura popolare - Rinascimento; Societa' - Venezia - XVI"
"PUV0314517";"Tessitori, Paola";1997;"Basta che finissa 'sti cani : democrazia e polizia nella Venezia del 1797";"history";"social; government";;"xviii";"Servizi di polizia. Personale.; GIUSTIZIA - Venezia - 1797; POLIZIA - 1797; SICUREZZA SOCIALE - 1797; GIUSTIZIA - 1797; Polizia - Venezia - 1797; Giustizia - Venezia ; XVIII"
"VEA0099173";"Crouzet-Pavan, Élisabeth";1997;"Venise: une invention de la ville : 13.-15. siecle";"history";"urban";;"middle ages; renaissance";"STORIA DI VENEZIA (PROV.); VENEZIA <REPUBBLICA> - Storia urbana - Sec. 13.-15.; STORIA - Sec. 13.-15.; Venezia <Repubblica> - Storia urbana - Sec. 13.-15.; Storia urbana - Venezia ; XIII-XV"
"VEA0101902";"Magani, Fabrizio";1997;"Il Panteon veneto";"arts";"crafts";;"xix";"SCULTURA. Italia nord-orientale; UOMINI CELEBRI VENETI - Ritratti - 1850-1900; BUSTI - Venezia - Istituto veneto di scienze lettere ed arti; UOMINI ILLUSTRI - Ritratti; Venezia - scultura"
"VEA1053633";"Romanelli, Giandomenico";1997;"L'art de Venise : 2";"arts";"painting";;;"Venezia - Arte; Arte - Venezia"
"VEA0105601";"a cura di Giandomenico Romanelli ... \et al";1998;"Venezia Quarantotto: episodi, luoghi e protagonisti di una rivoluzione 1848-49";"history";1848;"catalogue";"xix";"STORIA DI VENEZIA. 1815-1849; STORIA - 1848-1849; VENEZIA - Esposizioni - 1998-1999; REPUBBLICA VENETA DEL '49. - Esposizioni - Venezia - 1998-1999; VENEZIA - Storia - 1848-1849 - Esposizioni - Venezia - 1998-1999; VENEZIA - Esposizioni - 1998-1999; Risorgimento italiano - Venezia - Esposizioni; Venezia - Rivoluzione - 1848-49; Esposizioni - Venezia - 1998-99; Venezia - Storia - 1848-49 - Esposizioni; Venezia - Storia ; XIX"
"REA0043643";"Davanzo Poli, Doretta";1998;"Il merletto veneziano";"arts";"crafts";;;"MERLETTI. Venezia (prov.); MERLETTI; MERLETTI - Venezia - Storia; Merletti - Venezia"
"VEA0107892";"Bovolato, Luca";1998;"L' arte dei luganegheri a Venezia tra Seicento e Settecento";"history";"crafts; guilds";;"xvii; xviii";"TECNICA DELLE CARNI E DEGLI ELEMENTI AFFINI.; ARTE DEI LUGANEGHERI; VENEZIA - Corporazioni - Sec. 17.-18.; Corporazioni - Venezia - Sec. 17.-18; Artigianato - Venezia ; XVII-XVIII"
"CFI0414699";"Miato, Monica";1998;"L'Accademia degli Incogniti di Giovan Francesco Loredan, Venezia (1630-1661";"history";"individuals; culture";;"xvii";"LETTERATURA ITALIANA. Organizzazioni. Venezia; Venezia <Repubblica> - Storia - Sec. 17.; LOREDANO, GIOVANNI FRANCESCO; VENEZIA - Cultura - Sec. 17.; Accademia degli Incogniti <Venezia>; LOREDANO, GIOVANNI FRANCESCO; Venezia - Accademia degli Incogniti; Editoria - Venezia ; XVII"
"VEA0104356";;1998;"Il mondo di Giacomo Casanova: un veneziano in Europa, 1725-1798";"arts";"individuals; painting";"catalogue";"xviii";"STORIA GENERALE DELL'EUROPA. 1715-1789. Persone; CASANOVA, GIACOMO - Esposizioni - Venezia - 1998-1999; VENEZIA - Esposizioni - 1998-1999; CASANOVA, GIACOMO - Esposizioni - Venezia - 1998-1999; Casanova, Giacomo - Esposizioni - Venezia"
"CFI0417770";"Bonazzoli, Viviana";1998;"Adriatico e Mediterraneo orientale : una dinastia mercantile ebraica del secondo '600";"history";"jews; commerce";;"xvii";"COMMERCIO. Creta; COMMERCIO MARITTIMO - Sec. 17.; COMMERCIO MARITTIMO - Venezia <Repubblica> - Sec. 17.; COSTANTINI <FAMIGLIA> - Sec. 17.-18.; Costantini <Famiglia> - Attività commerciale - Creta - 1650-1750; Commercio - Venezia ; XVII"
"VIA0071281";"Quaranta, Elena";1998;"Oltre San Marco : organizzazione e prassi della musica nelle chiese di Venezia nel Rinascimento";"arts";"music; churches";;"renaissance";"MUSICA SACRA CRISTIANA. Venezia; MUSICA SACRA - Venezia - Sec. 16.; MUSICA SACRA - Sec. 16.; Musica - Venezia; XVI"
"MIL0456039";"Trivellato, Gianluigi";1998;"Venetian palazzi";"architecture";"palaces";;;"ARCHITETTURA DI PALAZZI. Venezia; Venezia - palazzi"
"PUV0390765";"Guzzetti, Linda";1998;"Venezianische Vermachtnisse : die soziale und wirtschaftliche Situation von Frauen im Spiegel spatmittelalterlicher Testamente";"history";"social; gender";"primary";"middle ages; renaissance";"ARCHIVI DI STATO - Venezia - Testamenti - Sec.14.-15.; DONNA - Condizioni economiche e sociali - Venezia - Sec. 14.-15- - Fonti; Donne veneziane - Vita privata - Medioevo; Donne - Condizioni socioeconomiche - Venezia; XIV-XV"
"VEA0103366";"a cura di Sebastiano Gentile";1998;"Oriente cristiano e santita : figure e storie di santi tra Bisanzio e l'Occidente";"arts";"religion";"catalogue";"middle ages";"ICONOGRAFIA. SANTI; SANTI - Impero d'Oriente; VENEZIA - Esposizioni - 1998; MANOSCRITTI MINIATI - Esposizioni - Venezia - 1998; SANTI - Iconografia - Esposizioni - Venezia - 1998; VENEZIA - Museo Correr - Biblioteca - Ms. Correr 1498 (I.416); VENEZIA - Museo Correr - Biblioteca - Ms. Correr 1508 (I.416); Santi - Agiografia cristiana"
"VEA0109196";"Tonon, Franco";1998;"Scuola dei Battuti di San Rocco : documenti sulle origini e illustrazione dei Capitoli delle Mariegole";"history";"schools; crafts; religion";"primary";;"SCUOLA DI SAN ROCCO; VENEZIA - Scuola Grande di San Rocco; VENEZIA - Chiesa di San Rocco; Venezia - Scuole-confraternite; Organizzazioni istituzionali - Fonti"
"VEA0110542";"Fees, Irmgard";1998;"Le monache di San Zaccaria a Venezia nei secoli 12. e 13";"history";"social; churches";;"middle ages";"VENEZIA - Chiesa di San Zaccaria; MONASTERO DI SAN ZACCARIA - Sec. 12.-13.; VENEZIA - Monastero di San Zaccaria - Sec. 12.-13.; Venezia - Ordini religiosi; Ordini religiosi - Venezia ; XII-XIII"
"VIA0069971";"Urban, Lina";1998;"Processioni e feste dogali : Venetia est mundus";"history";"social; entertainment; politics";;;"; FESTE PUBBLICHE - Venezia <Repubblica>; FESTE RELIGIOSE - Venezia <Repubblica>; VENEZIA <REPUBBLICA> - Feste dogali; VENEZIA <REPUBBLICA> - Processioni; FESTE DOGALI; PROCESSIONI; Venezia (Repubblica) - Processioni; Feste - Venezia(Repubblica)"
"VEA0106918";"Populin, Elisabetta";1998;"Il ponte dell'Accademia a Venezia, 1843-1986";"architecture";"urban";;"xix; recent";"PONTE DELL'ACCADEMIA; VENEZIA - Ponte dell'Accademia - 1843-1986; Venezia - ponti; XIX-XX"
"CFI0427021";"Perini, Sergio";1998;"La difesa militare della terraferma veneta nel Settecento";"history";"war";;"xviii";"ARTI E SCIENZE MILITARI. Italia nord-orientale; ESERCITO VENEZIANO - Sec. 18.; FORTIFICAZIONI - Venezia <Repubblica> - Sec. 18.; Venezia (Repubblica) - Difesa militare - Sec. 18; Storia militare - Venezia(Repubblica) ; XVIII"
"PUV0391846";"a cura di Oddone Longo";1998;"La porpora: realtà e immaginario di un colore simbolico : atti del Convegno di studio, Venezia, 24 e 25 ottobre 1996";"arts";"crafts";"catalogue";;"COLORAZIONE E TECNICHE CONNESSE. TINTURE NATURALI. Trattamento storico e geografico; VENEZIA - Congressi - 1996; PORPORA - Congressi - Venezia - 1996; Porpora - Studi"
"VEA0108692";"Brunello, Piero";1999;"Voci per un dizionario del Quarantotto : Venezia e Mestre, marzo 1848 agosto 1849";"history";1848;;"xix";"STORIA. VENEZIA. 1815-1849; VENEZIA - Storia - 1848-1849; STORIA - 1848-1849; MESTRE <VENEZIA> - Storia - 1848-1849; Venezia - Rivoluzione - 1848-49; Risorgimento italiano; Venezia - Storia ; XIX"
