"Bid";"Author";"Year";"Title corrected";"General category";"Keywords";"Typology";"Period";"Subjects"
"VEA0127166";"Stouraiti, Anastasia";2001;"Memorie di un ritorno : la guerra di Morea (1684-1699) nei manoscritti della Querini Stampalia";"history";"war";"primary";"xvii";"STORIA. ITALIA NORDORIENTALE VENETO. PERIODO DALL'INTERDETTO ALLA FINE DEL TERZO CONFLITTO CON L'IMPERO OTTOMANO, 1607-1718; MANOSCRITTI - Venezia - Fondazione scientifica Querini Stampalia; GUERRA DI MOREA. 1684-1699 - Storia - Fonti; MANOSCRITTI - Fondazione Querini Stampalia; GUERRA DI MOREA. 1684-1699 - Fonti manoscritte; Venezia (repubblica) - storia - fonti"
"VEA0132459";"edited by David Chambers and Brian Pullan";2001;"Venice : a documentary history, 1450-1630";"history";;"primary";"renaissance";"VENEZIA <REPUBBLICA> - Storia - Fonti - 1450-1630; Venezia - Politica e governo - 1450-1630; Venezia - Storia - 1450-1630; Venezia - Vita culturale e intellettuale - 1450-1630; Venezia - Storia - Fonti"
"VEA0147419";"Borgonovi, Paolo";2002;"Alessandro Poerio : l'eroe della sortita";"history";"1848; individuals";;"xix";"MESTRE <VENEZIA> - Storia - 1848; Poerio, Alessandro"
"PUV0827769";"a cura di Giovanni Bertelè";2002;"Il libro dei conti di Giacomo Badoer (Costantinopoli 1436-1440) : complemento e indici";"history";"commerce; individuals";"primary";"renaissance";"Contabilita'. Rendiconti finanziari.; CONTABILITA. RENDICONTI FINANZIARI; BADOER, GIACOMO . Il libro dei conti - Indici; Badoer, Giacomo. Libro dei conti - Indici; Venezia (repubblica) - storia economica; XV"
"VEA0151027";"Fees, Irmgard";2002;"Eine Stadt lernt schreiben : Venedig vom 10. bis zum 12. Jahrhundert";"history";"culture";;"middle ages";"SCRITTURA - Diffusione - Venezia <Repubblica> - Sec. 10.-12.; ISTRUZIONE - Venezia <Repubblica> - Sec. 10.-12.; SCRITTURA - Sec. 10.-12.; ISTRUZIONE - Sec. 10.-12.; Cultura - Venezia; X-XII"
"RML0115522";"Laven, David";2002;"Venice and Venetia under the Habsburgs, 1815-1835";"history";"government";;"xix";"VENEZIA - Dominazione austriaca - 1815-1835; STORIA - 1815-1835; Venezia - Storia ; XIX"
"VEA0147821";"catalogo della Mostra a cura di Francesco Bruni";2002;"Niccolò Tommaseo e il suo mondo: patrie e nazioni";"history";"individuals";"catalogue";"xix";"STORIA D'ITALIA. PERIODO RISORGIMENTALE, 1815-1861. Persone; TOMMASEO, NICCOLO - Esposizioni - Venezia - 2002-2003; TOMMASEO, NICCOLO - Documenti - Venezia - Museo Correr; VENEZIA - Museo Correr - Niccolo Tommaseo - Documenti; Cultura - Venezia; XIX"
"VEA0147985";"Nemeth, Gizella";2002;"Ludovico Gritti : un principe-mercante del Rinascimento tra Venezia, i turchi e la corona d'Ungheria";"history";"individuals; commerce";;"renaissance";"Storia del Veneto.; GRITTI, LUDOVICO; GRITTI, LUDOVICO"
"TO01202555";"Magno, Alessandro";2002;"Voyages : 1557-1565";"history";"literature";"primary";"renaissance";"GEOGRAFIA GENERALE, 1500-1599; VIAGGI - Descrizioni letterarie - Sec. 16."
"VIA0097382";"Raso, Carlo";2002;"Venezia : guida letteraria";"history";"literature";;;"VENEZIA - Vita artistica e culturale; VITA ARTISTICA E CULTURALE; SCRITTORI - Venezia; SCRITTORI; Venezia - cultura"
"VEA0175636";"Ruth Papadopoulos";2002;"Die Skulpturen des 13. Jahrhunderts an San Marco in Venedig";"arts";"monuments; churches";;;"Architettura di edifici per chiese cristiane. Venezia provincia.; SCULTURA. Venezia; VENEZIA - Chiesa di San Marco - Sculture; CHIESA DI SAN MARCO - Sculture"
"VEA0149600";"Gaier, Martin";2002;"Facciate sacre a scopo profano : Venezia e la politica dei monumenti dal Quattrocento al Settecento";"architecture";"monuments; politics";;"renaissance; xvii; xviii";"ARCHITETTURA DELLE CHIESE CRISTIANE. Venezia; VENEZIA - Monumenti - Sec. 15.-18.; VENEZIA - Chiese - Facciate - Sec. 15.-18.; MONUMENTI - Sec. 15.-18.; CHIESE - Facciate - Sec. 15.-18.; ARTE E POLITICA - Venezia <Repubblica> - Sec. 15.-18.; Architettura - Venezia; XV-XVIII"
"UMC0306925";"Venezia";2002;"Gli accordi con Curzola, 1352-1421";"history";"politics";"primary";"middle ages";"VENEZIA <REPUBBLICA> - Relazioni con Curzola - 1352-1421 - Documenti; RELAZIONI CON CURZOLA - 1352-1421; Venezia (Repubblica) - Relazioni con l'Albania - Sec. 14.-15.; Trattati - Venezia ; XIV-XV"
"VEA0136080";"Fournoux, Amable : de";2002;"Napoleon et Venise, 1796-1814";"history";"politics";;"xviii; xix";"STORIA. VENEZIA (PROV.); NAPOLEONE <IMPERATORE ; 1.> - Venezia - 1796-1814; VENEZIA - Storia - 1796-1814; VENEZIA - Storia - 1796-1814; NAPOLEONE E VENEZIA - 1796-1814; STORIA - 1796-1814; Napoleone 1. (Imperatore) - Venezia - 1796-1814; Venezia - Storia ; XVIII-XIX"
"LO10718904";"Calimani, Riccardo";2002;"L'inquisizione a Venezia : eretici e processi 1548-1674";"history";"religion; government";;"renaissance; xvii";"PERSECUZIONI DA PARTE DELL'INQUISIZIONE; INQUISIZIONE; EBREI - Processi - Sec. 16.-17.; INQUISIZIONE - Venezia - 1548-1674; EBREI - Processi - Venezia - Sec. 16.-17.; Ebrei - Processi - Venezia - Sec. 16.-17.; Inquisizione - Venezia ; XVI-XVII"
"CFI0547989";"Cladders, Brigitta";2002;"Französische Venedig-Reisen im 16. und 17. Jahrhundert : Wandlungen des Venedig-Bildes und der Reisebeschreibung";"history";"social";;"renaissance; xvii";"GEOGRAFIA. VENEZIA (PROV.); VIAGGIATORI FRANCESI - Venezia - Sec. 16.-17.; VENEZIA - Sec. 16.-17. - Descrizioni e viaggi; VIAGGIATORI FRANCESI - Sec. 16.-17.; DESCRIZIONI E VIAGGI - Sec. 16.-17.; Venezia (Repubblica) - Viaggi e viaggiatori - Sec. 16.-17.; Cultura - Venezia; XVI-XVII"
"VEA0150074";"Becker, Frank";2002;"Costruire Venezia : cinquecento anni di tecnica edilizia in laguna";"architecture";"urban";;"middle ages; renaissance; xvii; xviii";"Struttura architettonica. Storia. Europa. Venezia; EDILIZIA - Sec. 13.-18.; CASE A SCHIERA - Venezia - Sec. 13.-18.; Venezia - Edilizia - Sec. 13.-18.; Case a schiera - Venezia - Sec. 13.-18.; Architettura - Venezia - Storia"
"VEA0148611";"Keahey, John";2002;"Venice against the sea : a city besieged";"architecture";"urban; maritime";;;"VENEZIA - Conservazione"
"TO01512845";"Howard, Deborah";2002;"The architectural history of Venice";"architecture";;;;"Architettura - Venezia - Storia"
"VEA0145043";;2002;"Venezia|: Kunst aus venezianischen Palasten : Sammlungsgeschichte Venedigs vom 13. bis 19. Jahrhundert";"arts";"painting";"catalogue";"middle ages; renaissance; xvii; xviii; xix";"BELLE ARTI E ARTI DECORATIVE. Venezia; COLLEZIONI D'ARTE - Venezia - Sec. 13.-19. - Esposizioni - Bonn - 2002-2003; COLLEZIONI D'ARTE - Sec. 13.-19.; BONN - Esposizioni - 2002-2003; VENEZIA - Museo Correr - Opere d'arte - Sec. 13.-19.; OPERE D'ARTE - Sec. 13.-19. - Venezia - Museo Correr; VENEZIA - Musei civici - Opere d'arte - Sec. 13.-19.; OPERE D'ARTE - Sec. 13.-19. - Venezia - Musei civici; Arte - Venezia - 13.-19. sec. - Esposizioni; Venezia - Arte - 13.-19. sec. - Esposizioni; Arte - Venezia ; XIII-XIX"
"VEA1141201";"Peter Feldbauer, Jim Morrissey";2002;"Weltmacht mit Ruder und Segel : geschichte der Republik Venedig, 800-1600";"history";;;"middle ages; renaissance";"Venezia <Repubblica> - Storia - 800-1600"
"VEA0174911";"Cecchinato, Eva";2003;"La rivoluzione restaurata : il 1848-1849 a Venezia fra memoria e oblio";"history";1848;;"xix";"Storia. Venezia (comune).; VENEZIA - Storia - 1848-1849; STORIA - 1848-1849; Venezia - Storia - 1848-49; Venezia - Storia ; XIX"
"VEA0151680";"a cura di Giuliana Baso, Marisa Scarso, Camillo Tonini";2003;"La laguna di Venezia nella cartografia storica a stampa del Museo Correr";"arts";"cartography";"catalogue";"renaissance; xvii; xviii; xix";"RAPPRESENTAZIONI GRAFICHE DELLA SUPERFICIE TERRESTRE. Venezia (prov.); MUSEO CORRER - Cataloghi; VENEZIA - Museo Correr - Biblioteca - Cataloghi; LAGUNA DI VENEZIA - Carte geografiche - Sec. 16.-19. - Venezia - Museo Correr; LAGUNA DI VENEZIA - Carte geografiche - Sec. 16.-19. - Venezia - Museo Correr - Biblioteca; CARTE GEOGRAFICHE - Sec. 16.-19. - Venezia - Museo Correr - Biblioteca; LAGUNA - Carte geografiche - Sec. 16.-19.; Laguna di Venezia - Carte geografiche - Sec. 16.-19.; Cartografia - Laguna ; XVI-XIX"
"PUV0970071";"Della Valentina, Marcello";2003;"Operai, mezzadi, mercanti : tessitori e industria della seta a Venezia tra '600 e '700";"history";"crafts; industry; commerce";;"xvii; xviii";"BENI E SERVIZI. Seta. Italia; SETA - Venezia - Storia; Seta - Industria - Venezia - Sec. 16.- 17; Industria tessile - Venezia ; XVII-XVIII"
"VEA0177384";"Sethre, Janet";2003;"The souls of Venice";"history";"culture";;;"STORIA. VENEZIA; Uomini celebri - Venezia; UOMINI ILLUSTRI; Venezia - Civiltà; Cultura Venezia"
"VEA0180885";"Malpezzi Price, Paola";2003;"Moderata Fonte : women and life in sixteenth-century Venice";"history";"gender";;"renaissance";"MISCELLANEA ITALIANA. 1542-1585; MODERATA FONTE; MODERATA FONTE; DONNA - Posizione sociale - Venezia - Sec. 16.; DONNE - Posizione sociale - Sec. 16.; Venezia - storia sociale; XVI"
"TO01238609";"Datta, Satya";2003;"Women and men in early modern Venice : reassessing history";"history";"gender";;"renaissance; xvii; xviii";"Italia. Provincia di Venezia. Dal 16. al 18. sec.; CLASSI SOCIALI INFERIORI. CLASSI LAVORATRICI (PROLETARIATO); DONNE LETTERATE - Sec. 16.-17.; VENEZIA - Storia sociale - Sec. 16.-17.; DONNA - Posizione sociale - Venezia - Sec. 16.-17; STORIA SOCIALE - Sec. 16.-17.; DONNE - Posizione sociale - Sec. 16.-17.; Artigiani - Venezia (Repubblica) - Condizioni sociali"
"PUV0933950";"Silvestrini, Elisabetta";2003;"Donne, madonne, dee : abito sacro e riti di vestizione, gioiello votivo, vestitrici";"history";"gender; crafts; entertainment; religion";;;"FESTE RELIGIOSE - Venezia <provincia>; MADONNA - Culto - Venezia <provincia>; SCULTURA SACRA - Venezia <provincia>; MADONNA - Culto; Madonna - Culto - Venezia; Venezia - culto"
"VEA0186856";"Rubini, Edoardo";2003;"Giustizia veneta : lo spirito veneto nelle leggi criminali della Repubblica";"history";"government";;;"GIUSTIZIA PENALE; GIUSTIZIA PENALE - Venezia <Repubblica> - Storia; Giustizia - Venezia(Repubblica)"
"PUV0935367";"a cura di Claudio Povolo";2003;"Il processo a Paolo Orgiano : 1605-1607";"history";"individuals";"primary";"xvii";"ORGIANO, PAOLO - Processo; Orgiano, Paolo <nobile vicentino ; Processo a carico ; 1605-1607>; Venezia (Repubblica) - Consiglio dei Dieci - Amministrazione della giustizia - Sec. 16.-17.; Legislazione penale - Venezia - Fonti ; XVII"
"VEA0185075";"Caminer Turra, Elisabetta";2003;"Selected writings of an eighteenth century venetian woman of letters";"history";"literature; gender";"primary";"xviii";"Storia di Venezia. 1945-; CAMINER, ELISABETTA; Caminer Turra, Elisabetta <1751-1796>; Fonti ; XVIII"
"VEA0152806";"Misan-Montefiore, Jacques";2003;"L'eau, le rêve et le temps : Venise vue par les voyageurs français de 1850 à 1920";"history";"social";;"xix; recent";"GEOGRAFIA. VENEZIA (PROV.); VIAGGIATORI FRANCESI - Venezia - 1850-1920; VENEZIA - 1850-1920 - Descrizioni e viaggi; DESCRIZIONI E VIAGGI - 1850-1920; VIAGGIATORI FRANCESI - 1850-1920; Cultura - Venezia; XIX-XX"
"PUV0952955";"a cura di Carmelo Alberti";2003;"Teatro nel Veneto";"history";"social; entertainment";;;"VENEZIA NEL CINEMATOGRAFO; CARNEVALE - Storia; VENEZIA - Carnevale - Storia; Cinema - Venezia; TEATRO - Veneto"
"VEA1140947";"Sciama, Lidia D";2003;"A Venetian Island : environment, history and change in Burano";"architecture";"urban; lagoon";;;"Venezia - Isole - Burano - Storia; Isole - Venezia - Storia"
"VEA0180703";"a cura di Giorgio Rossini, in collaborazione con Roberta Battaglia, Gabriella Delfini, Ettore Merkel";2003;"Venezia fra arte e guerra, 1866-1918: opere di difesa, patrimonio culturale, artisti, fotografi";"arts";"war";"catalogue";"xix; recent";"STORIA DI VENEZIA (PROV.); STORIA. VENEZIA (PROV.); VENEZIA - Esposizioni - 2003-2004; VENEZIA - Storia militare - 1866-1918 - Esposizioni - Venezia - 2003-2004; FORTIFICAZIONI - Venezia - 1866-1918 - Esposizioni - Venezia - 2003-2004; FORTIFICAZIONI - 1914-1918; GUERRA MONDIALE 1. (1915-18); VENEZIA - Esposizioni - 2003-2004; Esposizioni - Venezia - 2003-04"
"CAG0567258";"Wladimiro Dorigo";2003;"Venezia romanica : la formazione della città medioevale fino all'età gotica";"architecture";"urban";"primary";"middle ages";"Urbanistica - Venezia - Storia - Sec. 11.-14. - Fonti; Arte romanica - Venezia - Storia - Fonti; Urbanistica - Venezia - Storia"
"LO10868552";"Tomaz, Luigi";2003;"In Adriatico nell'antichità e nell'alto Medioevo : da Dionigi di Siracusa ai Dogi Orseolo";"history";"empire";;"middle ages";"STORIA MONDIALE. Mare Adriatico; PAESI ADRIATICI - Storia - Sec. 6. a.C.- 11. d.C.; DALMAZIA E VENEZIA - Sec. 1. a.C.-11. d.C.; ISTRIA E VENEZIA - Sec. 1. a.C.-11. d.C."
"VEA1138356";"Reinhard Lebe";2003;"Mythos Venedig : Geschichte und Legenden aus tausend Jahren";"history";"myth";;;"Venezia - storia"
"VEA1139302";"Catherine Koumarianou";2004;"Avvisi (1570-1572) : the War of Cyprus";"history";"culture; war";"primary";"renaissance";"Cipro - Storia - 1570-1572 - Fonti archivistiche; Storia - Venezia - Fonti ; XVI"
"UBO2555689";"Mazza, Cristiana";2004;"I Sagredo : committenti e collezionisti d'arte nella Venezia del Sei e Settecento";"arts";"elites; collecting";;"xvii; xviii";"BELLE ARTI E ARTI DECORATIVE. GALLERIE, MUSEI, COLLEZIONI PRIVATE; SAGREDO <FAMIGLIA> - Collezioni; SAGREDO <FAMIGLIA>; Sagredo <famiglia> - Mecenatismo - Sec.17.-18.; Venezia - collezionismo; XVII-XVIII"
"MIL0630361";"a cura di Nelli-Elena Vanzan Marchini";2004;"Rotte mediterranee e baluardi di sanità : Venezia e i lazzaretti mediterranei";"history";"empire; health";;"renaissance; xvii; xviii";"CURE MEDICHE. OSPEDALI E ISTITUTI AFFINI; CURE MEDICHE. OSPEDALI E ISTITUTI AFFINI; ; STORIA DELLE EPIDEMIE. Mar Mediterraneo; VENEZIA <REPUBBLICA> - Relazioni economiche e commerciali - Sec. 15.-18.; COMMERCIO - Sec. 15.-18.; VENEZIA <REPUBBLICA> - Sanita pubblica - Sec. 15.-18.; LAZZARETTI - Paesi mediterranei; LAZZARETTI; Venezia <Repubblica> - Sanità pubblica - Sec. 15.-18.; Sanita pubblica - Venezia ; XV-XVIII"
"TO01374721";"Hacke, Daniela";2004;"Women, sex and marriage in early modern Venice";"history";"gender; social";;"renaissance; xvii; xviii";"MATRIMONIO - Venezia <Repubblica> - Sec. 16.-17.; Matrimonio - Venezia - Storia; Donne veneziane - Condizione sociale - Sec. 16; Donne - Condizioni socioeconomiche - Venezia ; XVII"
"VEA0182343";"De Paoli, Marcella";2004;"Opera fatta diligentissimamente : restauri di sculture classiche a Venezia tra Quattro e Cinquecento";"arts";"monuments";;"renaissance";"SCULTURA GRECA, ETRUSCA, ROMANA; MUSEO ARCHEOLOGICO - Statue antiche; SCULTURE CLASSICHE - Restauro - Venezia - Sec. 15.-16.; SCULTURE CLASSICHE - Venezia - Museo archeologico; Venezia - Museo archeologico nazionale - Statue - Restauro (sec. 15.-16.); Sculture classiche - Restauro"
"VIA0116829";"Schulz, Juergen";2004;"The new palaces of medieval Venice";"architecture";"palaces";;"middle ages";"VENEZIA - Palazzi; Venezia - Architettura - Gotico; Architettura - Venezia ; XIII-XV"
"VEA0190110";"a cura di Giandomenico Romanelli";2004;"Palazzo Ducale : storia e restauri";"architecture";"palaces";;;"VENEZIA - Palazzo ducale"
"VEA0187410";"Rossato, Valerio";2004;"Storia di una fabrica voluptuosa: Villa Malipiero-Barbarich a Zelarino";"architecture";"palaces";;;"ZELARINO - Villa Barbarich - Storia; ZELARINO - Villa Barbarich - Storia; Zelarino (Venezia) - Villa Barbarich - Storia"
"PUV0970202";"Venezia";2004;"I patti con l'Impero latino di Costantinopoli, 1205-1231";"history";"politics";"primary";"middle ages";"STORIA. VENEZIA (PROV.). 1200-1259; VENEZIA <REPUBBLICA> E IMPERO LATINO D'ORIENTE - 1205-1231 - Documenti; RELAZIONI CON L'IMPERO LATINO D'ORIENTE - 1205-1231 - Documenti; Venezia (Repubblica) - Relazioni con l'impero latino di Costantinopoli - Documenti - 1205-1231; trattati - venezia; XIII"
"VEA0190413";"Sanudo, Marino";2004;"Le vite dei dogi, 1423-1474";"history";"politics";"primary";"renaissance";"Venezia (repubblica) - fonti; XV"
"IEI0226084";"Jaszay, Magda";2004;"Venezia e Ungheria : la storia travagliata di una vicinanza";"history";"politics";;;"STORIA. VENEZIA (PROV.); RELAZIONI CON L'UNGHERIA; VENEZIA <REPUBBLICA> E UNGHERIA; Venezia (Repubblica) - Relazioni con l'Ungheria; Venezia - Rapporti [con l']Ungheria"
"RML0163921";;2004;"La caduta di Costantinopoli, 1204 : fonti bizantine e occidentali sulla Quarta crociata";"history";"politics; war";"primary";"middle ages";"Crociate <4 ; 1202-1204> - Storiografia - Congressi"
"MIL0636898";"Witcombe, Christopher L. C. E";2004;"Copyright in the Renaissance : bookss and the privilegio in sixteenth-century Venice and Rome";"history";"books; industry; intellectual";;"renaissance";"DIRITTI D'AUTORE. ITALIA; REGOLAMENTAZIONE E CONTROLLO DELLA STAMPA. ITALIA; STAMPA - Legislazione - Sec. 16.; STAMPA - Legislazione - Sec. 16.; PRIVILEGI DI STAMPA - Venezia - Sec. 16.; PRIVILEGI DI STAMPA - Roma - Sec. 16.; Editoria - Venezia; XVI"
"UBO2480186";"Laven, Mary";2004;"Monache : vivere in convento nell'età della Controriforma";"history";"social; religion";;"renaissance; xvii";"Congregazioni e ordini religiosi nella storia della chiesa. Congregazioni e ordini femminili.; CONGREGAZIONI E ORDINI FEMMINILI NELLA STORIA DELLA CHIESA. Venezia (prov.); Venezia - Monasteri femminili - Sec. 16.-17.; Monache - Venezia - Sec. 16.-17.; Storia ecclesiastica ; XVI-XVII"
"CFI0617028";"Concina, Ennio";2004;"Storia dell'architettura di Venezia dal 7. al 20. secolo";"architecture";;;"middle ages; renaissance; xvii; xviii; xix; recent";"ARCHITETTURA. Venezia; Architettura - Venezia - Sec. 7.-20.; Architettura - Venezia - Storia ; VII - XX"
"PUV1005637";"Hocquet, Jean-Claude";2004;"Venise au Moyen Age";"history";;;"middle ages";"Venezia - Sec. 8.-15."
"TO01458757";"Keates, Jonathan";2005;"The siege of Venice";"history";1848;;"xix";"Risorgimento italiano - Venezia - 1848-1849; Venezia - Storia ; XIX"
"PUV1057796";"Modesti, Paola";2005;"Il Convento della carità e Andrea Palladio : storie, progetti, immagini";"architecture";"churches; individuals";;"renaissance";"ARCHITETTURA DI MONASTERI. Persone; VENEZIA - Convento di Santa Maria della Carita; PALLADIO, ANDREA - Venezia - Convento di Santa Maria della Carita; Venezia - Convento della Carita; Architettura - Venezia; XVI"
"VEA0690689";"curator Doretta Davanzo Poli";2005;"The arts and crafts of fashion in Venice: from the 13. to the 18. century";"arts";"crafts";"catalogue";"middle ages; renaissance; xvii; xviii";"ABBIGLIAMENTO - Venezia - Sec. 13.-18. - Esposizioni - San Pietroburgo - 2005; SAN PIETROBURGO - Esposizioni - 2005; Stoffe - Sec.13.-18. - Esposizioni - 2005; Abbigliamento - Sec.13.-18. - Esposizioni - 2005; Abbigliamento - Venezia; XIII-XVIII"
"VEA0196688";"Fees, Irmgard";2005;"Ricchezza e potenza nella Venezia medioevale : la famiglia Ziani";"history";"elites";;"middle ages";"VENEZIA - Storia - Sec. 10.-14.; ZIANI <FAMIGLIA>; ZIANI <FAMIGLIA>; Ziani(Famiglia)"
"VEA0193792";"Caniato, Giovanni";2005;"L'arcipelago dimenticato : isole minori della laguna di Venezia tra storia e natura";"history";"lagoon";;;"Geografia. Venezia.; FAUNA - Laguna di Venezia; FLORA - Laguna di Venezia; ISOLE - Laguna di Venezia - Storia; ISOLE; Venezia - isole"
"VEA0194174";"Lermer, Andrea";2005;"Der gotische Dogenpalast in Venedig : Baugeschichte und Skulpturenprogramm des Palatium Communis Venetiarum";"architecture";"palaces";;;"Architettura di palazzi e castelli. Venezia.; VENEZIA - Palazzo ducale; PALAZZO DUCALE; Architettura - Venezia ;"
"MOD0951234";"Venezia";2005;"I patti con Bologna (1227-1321";"history";"politics";"primary";"middle ages";"VENEZIA <REPUBBLICA> - Relazioni con Bologna - 1227-1321 - Documenti; RELAZIONI CON BOLOGNA - 1227-1321; Venezia (Repubblica) - Relazioni con Bologna - Documenti - 1227-1321; trattati - Venezia; XIII-XIV"
"PUV1060835";"Venezia";2005;"I patti con il patriarcato di Aquileia, 880-1255";"history";"politics";"primary";"middle ages";"AQUILEIA <PATRIARCATO> - Storia - Fonti; AQUILEIA E VENEZIA - Relazioni politiche; Venezia (Repubblica) - Relazioni con il Patriarcato di Aquileia - Sec. 9.-13.; Venezia - trattati; IX-XIII"
"UBO2841837";"Orlando, Ermanno";2005;"Ad profectum patrie : la proprietà ecclesiastica veneziana in Romania dopo la 4. crociata";"history";"politics; religion";"primary";"middle ages";"Storia della Grecia. Periodo tardo bizantino, 1081-1204; BENI ECCLESIASTICI - Romania - Sec. 13.; BENI ECCLESIASTICI - ROMANIA - SEC. 13.; BENI ECCLESIASTICI - Candia - Sec. 13.; Venezia (Repubblica) e Romania - Storia - Sec. 13. - Fonti"
"VEA0206994";"Cooper, Tracy E";2005;"Palladio's Venice : architecture and society in a Renaissance republic";"architecture";"social";;"renaissance";"ARCHITETTI; PALLADIO, ANDREA; ARCHITETTURA - Venezia - Sec. 16.; Palladio, Andrea; Palladio, Andrea - Architettura - Rinascimento - Venezia - Sec. 16.; Architettura - Venezia; XV-XVI"
"TO01473567";"Chauvard, Jean François";2005;"La circulation des biens à Venise : stratégies patrimoniales et marché immobilier, 1600-1750";"history";"social";;"xvii; xviii";"STORIA DI VENEZIA. 1607-1718; PROPRIETA IMMOBILIARE - Venezia - Sec. 17.-18.; PROPRIETA IMMOBILIARE - Sec. 17.-18.; IMMOBILI - Mercato - Venezia - Sec. 17.-18.; Venezia (Repubblica) - Patrimoni ereditari - Sec. 17.-18; Venezia (Repubblica) - Mercato immobiliare - Sec. 17.-18.; Commercio - Venezia(Repubblica) ; XVII-XVIII"
"VIA0127336";"Vanzan Marchini, Nelli-Elena";2005;"Venezia : luoghi di paure e voluttà";"history";"social";;;"STORIA. VENEZIA; VENEZIA <REPUBBLICA> - Sanita pubblica; Venezia - Descrizioni e viaggi; Venezia - Storia - Usi e costumi"
"PUV1071138";"Gasparini, Silvia";2005;"Tra fatto e diritto : avvocati e causidici a Venezia nell'età moderna";"history";"social; government";;"renaissance; xvii; xviii";"AVVOCATI - Professione - Venezia <Repubblica> - Sec. 15.-18.; Avvocati - Sec. 15.-18.; Venezia (Repubblica) - Avvocatura - Sec. 18.; Magistratura - Venezia(Repubblica) ; XV-XVIII"
"PUV1034930";"Bobbo, Giulio";2005;"Venezia in tempo di guerra : 1943-1945";"history";"war";;"recent";"VENEZIA - Storia - 1943-1945; RESISTENZA - Venezia; Guerra mondiale 1939-1945 - Venezia - Liberazione; GUERRA MONDIALE 1939-45 - Venezia - 1943-1945; Storia - Venezia ; XX"
"PUV1053949";"Moro, Federico";2005;"Venezia in guerra : le grandi battaglie della Serenissima";"history";"war";;;"STORIA. VENEZIA (PROV.); VENEZIA <REPUBBLICA> - Storia militare; STORIA MILITARE"
"VEA0207279";"Masè, Federica";2006;"Patrimoines immobiliers ecclésiastiques dans la Venise médiévale, 11.-15. siècle : une lecture de la ville";"history";"churches; economics";"primary";"middle ages";"BENI ECCLESIASTICI - Venezia - Sec. 11.-15. - Fonti documentarie; BENI ECCLESIASTICI - Sec. 11.-15.; Beni ecclesiastici - Venezia - Medioevo; Urbanesimo - Venezia - Medioevo; Politica ecclesiastica - Venezia; XI-XV"
"VEA0713123";"Melville-Jones, John R";2006;"Venice and Thessalonica 1423-1430: the Greek accounts";"history";"empire";"primary";"renaissance";"SALONICCO - 1423-1430; SALONICCO - Storia - 1423-1430 - Fonti"
"TO01546358";"Amoretti, Guido";2006;"La Serenissima repubblica in Grecia : 17.-18. secolo";"history";"empire";;"xvii; xviii";"GEOGRAFIA. GRECIA; GRECIA - Carte geografiche; GRECIA - Carte geografiche - Sec. 17.-18.; FORTIFICAZIONI - Grecia - Sec. 17.-18.; PARAVIA, ANTONIO; CARTE GEOGRAFICHE - Grecia - Sec. 17.-18. - Venezia - Museo Correr - Biblioteca; VEDUTE - Grecia - Sec. 17.-18. - Venezia - Museo Correr - Biblioteca; VENEZIA - Museo Correr - Biblioteca - Carte geografiche - Grecia - Sec. 17.-18.; VENEZIA - Museo Correr - Biblioteca - Vedute - Grecia - Sec. 17.-18.; PARAVIA, ANTONIO; Grecia - Dominazione [di] Venezia; XVII-XVIII"
"USM1591112";"Dursteler, Eric R";2006;"Venetians in Constantinople : nation, identity, and coexistence in the early modern Mediterranean";"history";"empire; social";;"renaissance; xvii; xviii";"Storia. Turchia europea. Provincia di Istanbul. 1453-1918.; MERCANTI VENEZIANI - Costantinopoli - Sec. 16.-18.; RELAZIONI CON L'IMPERO OTTOMANO - Sec. 16.-18.; VENEZIA <REPUBBLICA> E IMPERO OTTOMANO - Sec. 16.-18.; Venezia e Costantinopoli - Studi; Venezia - Rapporti [con l'] Oriente ; XVI-XVIII"
"VIA0143823";"Giormani, Virgilio";2006;"Il conte Alvise Zenobio, 1757-1817 : un patrizio veneto tra agio e avventura";"history";"individuals";;"xviii; xix";"ZENOBIO, ALVISE; ZENOBIO, ALVISE; Zenobio, Alvise ; XVIII-XIX"
"VEA0696876";"Friedrichs, Cornelia";2006;"Francesco Guardi : Venezianische Feste und Zeremonien";"arts";"individuals; painting";;"xviii";"Guardi, Francesco; FESTE PUBBLICHE - Venezia <Repubblica> - Iconografia - Sec. 18.; CERIMONIE - Venezia <Repubblica> - Iconografia - Sec. 18.; Feste - Venezia(Repubblica); XVIIII"
"VEA0699544";"Busato, Davide";2006;"Metamorfosi di un litorale : origine e sviluppo dell'isola di Sant'Erasmo nella laguna di Venezia";"architecture";"lagoon";;"renaissance";"STORIA. VENEZIA; ISOLA DI SANT'ERASMO; SANT'ERASMO <Venezia> - Storia - Origini-Sec. 16.; Venezia - Isola di Sant'Erasmo - Storia; Sant'Erasmo - Storia"
"VIA0143607";"Neerfeld, Christiane";2006;"Historia per forma di diaria : la cronachistica veneziana contemporanea a cavallo tra il Quattro e il Cinquecento";"history";"literature";"primary";"renaissance";"CRONACHE - Venezia - Sec. 15.-16.; VENEZIA <REPUBBLICA> - Storia - Sec. 15.-16. - Fonti; STORIA - Fonti - Cronache - Sec. 15.-16.; Venezia(Repubblica) - Fonti ; XV-XVI"
"VEA0203443";"edites par Christian Del Vento et Xavier Tabet";2006;"Le mythe de Venise au 19. siecle : debats historiographiques et representations litteraires";"history";"myth";;"xix";"STORIA DEL VENETO. PERIODO DALLA FINE DEL TERZO CONFLITTO CON L'IMPERO OTTOMANO AL TRATTATO DI CAMPOFORMIO, 1718-1797; VENEZIA NELLA LETTERATURA - Sec. 19. - Congressi - Caen - 2004; VENEZIA - Storiografia - Sec. 19. - Congressi - Caen - 2004; VENEZIA NELLA LETTERATURA - Sec. 19.; CAEN - Congressi - 2004; Venezia - Storiografia - Sec. 19.; Venezia - Fortuna - Letteratura ; XIX"
