"","age_category","author","availability","core","id","in_degree","is_cited","is_citing","lb","out_degree","place","publ_country","publ_language","title","type_category","year","topicality_final","topicality","bridging_final","community_max"
"SBL0651158","3.0","Bouwsma, William J","30","True","33011","49","True","True","True","159","Berkeley","US","eng","Venice and the defense of republican liberty : Renaissance values in the age of the Counter Reformation","3.0","1968.0","0.389554794520548","0.9375","-0.5988501620268082","1"
"SBL0653861","3.0","Brulez, Wilfrid","12","True","31330","17","True","False","False","0","Bruxelles","BE","fre","Marchands flamands à Venise","3.0","","0.199764982373678","0.9565217391304348","-0.7391304347826086","1"
"SBL0654449","3.0","Grendler, Paul F","39","True","17926","11","True","False","False","0","Madison","US","eng","Critics of the Italian world, 1530-1560 : Anton Francesco Doni, Nicolo Franco and Ortensio Lando","3.0","1969.0","0.20374220374220375","0.972972972972973","-1.102910602910603","1"
"SBL0654784","3.0","Cet ouvrage a été élaboré par l'équipe de Réalités animée par G. D'Angelis","14","True","5602","16","True","False","False","0","Paris","FR","fre","Venise au temps des galères","3.0","1968.0","0.025000000000000022","0.9","-0.328125","2"
"SBL0655175","3.0","Goldthwaite, Richard A","26","True","7160","11","True","False","False","0","Princeton, N.J","US","eng","Private wealth in Renaissance Florence : a study of four families","3.0","1968.0","0.4375","0.9375","-0.5","1"
"SBL0669453","2.0","Coryate, Thomas","2","True","23705","23","True","False","False","0","Glasgow","GB","eng","Coryatʼs crudities : hastily gobled up in five moneths travells in France, Savoy, Italy, Rhetia ..","3.0","1905.0","0.19405594405594406","0.8863636363636364","-0.6534090909090908","1"
"SBL0670172","3.0","Burke, Peter","19","True","15452","20","True","False","True","0","London","GB","eng","Venice and Amsterdam : a study of seventeenth-century élites","3.0","1974.0","0.3062036055143159","0.9891304347826086","-0.943796394485684","1"
"SBL0679145","3.0","Howard, Deborah","20","True","34961","10","True","False","True","0","New Haven","US","eng","Jacopo Sansovino : architecture and patronage in Renaissance Venice","3.0","1975.0","0.3406593406593407","0.7692307692307693","-0.9010989010989012","1"
"SBL0682886","3.0","Delumeau, Jean","51","True","5014","13","True","False","False","0","Paris","FR","fre","Vie économique et sociale de Rome dans la seconde moitié du 16. siècle","3.0","","0.5","1.0","-1.8583333333333332","1"
"SBL0685548","3.0","Wolters, Wolfgang","15","True","36413","12","True","False","False","0","Berlin","DE","ger","Plastische Deckendekorationen des Cinquecento in Venedig und im Veneto","3.0","1968.0","0.125","1.0","-0.7291666666666666","0"
"SBL0685905","3.0","Demus, Otto","23","True","3541","34","True","False","False","0","Washington","US","eng","The church of San Marco in Venice : history, architecture, sculpture","3.0","1960.0","0.5301387970918705","0.8595505617977528","-0.6654329147389293","0"
"SBL0690333","3.0","Herausg. von Ulrich Thieme und Felix Becker","3","True","5799","16","True","False","False","0","Leipzig","DD","ger","Allgemeines Lexikon der bildenden Künstler von der Antike bis zur Gegenwart","2.0","1970.0","-0.0038819875776396895","0.9782608695652174","0.025232919254658315","0"
"SBL0699847","3.0","Tiziano","29","True","23176","16","True","False","False","0","London","GB","eng","The paintings of Titian","3.0","1966.0","0.3623417721518988","0.9873417721518988","-1.2937763713080168","0"
"SBL0709490","3.0","Trincanato, Egle Renata","10","True","14835","12","True","False","False","0","Boulogne","FR","fre","Venise au fil du temps : atlas historique d'urbanisme et d'architecture","3.0","1971.0","0.28787878787878796","0.8333333333333334","-0.9267676767676769","0"
"SBL0711865","3.0","Stromer, Wolfgang : von","18","True","14575","13","True","False","False","0","Venezia","IT","ita","Bernardus Teotonicus e i rapporti commerciali tra la Germania meridionale e Venezia prima della istituzione del Fondaco dei Tedeschi","3.0","1978.0","0.2586872586872587","0.972972972972973","-1.221042471042471","2"
"SBL0712864","2.0","raccolti dal prof. R. Fulin","17","True","13840","21","True","False","False","0","Venezia","IT","ita","Documenti per servire alla storia della tipografia veneziana","1.0","1882.0","0.243302752293578","0.963302752293578","-0.808440366972477","0"
"SBL0738944","2.0","","53","True","20985","10","True","False","False","0","Venezia","IT","ita","Antichi scrittori d'idraulica veneta","1.0","","0.3375","0.9375","-0.375","0"
"SBL0745559","2.0","Schaube, Adolf","1","True","673","14","True","False","False","0","München","DD","ger","Handelsgeschichte der Romanischen Völker des Mittelmeergebiets bis zum Ende der Kreuzzüge","3.0","1906.0","0.4","1.0","-1.14","2"
"SBLE005612","1.0","Trevisan, Bernardo","1","True","15975","15","True","False","False","0","Venezia","IT","ita","Della laguna di Venezia","1.0","1718.0","0.07352941176470584","0.8235294117647058","-0.4117647058823529","0"
"SBLE006501","2.0","Zendrini, Bernardino","18","True","16179","35","True","False","False","0","Padova","IT","ita","Memorie storiche dello Stato antico e moderno delle lagune di Venezia e di que' fiumi che restarono divertiti per la conservazione delle medesime di Bernardino Zendrini ... Tomo 1. [-2.","3.0","1811.0","0.15869565217391302","0.75","-0.040827612509534705","0"
"SBLE007826","1.0","Boschini, Marco","26","True","29828","33","True","False","False","0","In Venezia","IT","ita","Le minere della pittura. Compendiosa informazione di Marco Boschini non solo delle pitture publiche di Venezia: ma dell'isole ancora circonuicine ","1.0","1664.0","0.12838824020016681","0.9977064220183486","-0.880056296914095","0"
"SBLE008079","1.0","Corner, Flaminio","13","True","29014","64","True","False","False","0","In Padova","IT","ita","Notizie storiche delle chiese e monasteri di Venezia, e di Torcello tratte dalle chiese veneziane, e torcellane illustrate da Flaminio Corner senator veneziano","3.0","1758.0","0.5241806430159819","0.966041108132261","-0.8312083047571543","0"
"SBLE010866","1.0","Bernard : de Montfaucon","36","True","19677","10","True","False","False","0","Parisiis","FR","lat","Diarium italicum. Sive Monumentorum veterum, bibliothecarum musæorum, &c. Notitiæ singulares in itinerario Italico collectæ. Additis schematibus ac figuris. A r.p. d. Bernardo de Montfaucon, monacho Benedectino, Congregationis sancti Mauri","1.0","1702.0","0.25","1.0","-1.1125","0"
"SBLE015644","1.0","Sansovino, Francesco","21","True","12538","53","True","False","False","0","In Venetia","IT","ita","Venetia città nobilissima et singolare; descritta già in 14. libri da m. Francesco Sansouino: et hora con molta diligenza corretta, emendata, e più d'vn terzo di cose nuoue ampliata dal M.R.D. Giouanni Stringa, ... Con sette tauole copiosissime, & priuilegio","1.0","1604.0","0.45044183229642676","0.9717832957110609","-0.9311890932114738","0"
"SBLE018193","2.0","Lanzi, Luigi","1","True","22586","11","True","False","False","0","Bassano","IT","ita","Storia pittorica della Italia : dal risorgimento delle belle arti fin presso al fine del 18. secolo","3.0","1809.0","0.375","1.0","-1.34375","0"
"SIP0296084","2.0","Heyd, Wilhelm : von","1","True","2201","22","True","False","False","0","Leipzig","DE","fre","Histoire du commerce du levant au Moyen age","3.0","1923.0","0.048857368006304136","0.8148148148148148","-0.5874704491725768","2"
"TES0034887","2.0","Heyd, Wilhelm : von","11","True","18952","10","True","False","False","0","Leipzig","DE","fre","Histoire du commerce du levant au moyen-age","3.0","","0.0625","1.0","-0.5758928571428572","2"
"TO00001065","3.0","Cessi, Roberto","3","True","7281","12","True","False","False","0","Venezia","IT","ita","Venezia nel Duecento : tra Oriente e Occidente","3.0","1985.0","0.045454545454545414","1.0","-1.0681818181818181","2"
"TO00032351","3.0","Antonio Carile, Giuseppe Cuscito ... <et al.","1","True","26003","11","True","False","False","0","Venezia","IT","ita","Le origini della Chiesa di Venezia","3.0","1987.0","0.06349206349206349","0.7777777777777778","-0.3386243386243386","2"
"TO00040403","3.0","Preto, Paolo","87","True","24484","24","True","False","False","0","Vicenza","IT","ita","Peste e società a Venezia nel 1576","3.0","1978.0","0.3053306342780028","0.8974358974358975","-0.5705128205128205","1"
"TO00051946","3.0","Pezzolo, Luciano","8","True","36298","14","True","False","False","0","Venezia","IT","ita","L'oro dello Stato : societa, finanza e fisco nella Repubblica veneta del secondo '500","3.0","1990.0","0.6100746268656716","0.9850746268656716","-1.0708955223880596","1"
"TO00066105","3.0","Queller, Donald E","13","True","16769","22","True","False","True","0","Urbana","US","eng","The Venetian patriciate : reality versus myth","3.0","1986.0","0.32287954383464","0.9130434782608695","-0.8246614397719172","1"
"TO00097940","3.0","Cessi, Roberto","55","True","36117","24","True","False","False","0","Napoli","IT","ita","Le origini del ducato veneziano","3.0","1951.0","0.3380406001765226","0.883495145631068","-0.6286407766990292","2"
"TO00106920","3.0","a cura di Gabriele Mazzucco","30","True","22879","16","True","True","True","126","Venezia","IT","ita","Monasteri benedettini nella laguna veneziana : catalogo di mostra","3.0","1983.0","-0.1853281853281854","0.5714285714285714","-0.4511858797573083","0"
"TO00107911","2.0","a cura di Giovanni Monticolo","76","True","19425","54","True","False","False","0","Roma","IT","lat","I capitolari delle Arti veneziane sottoposte alla Giustizia e poi alla Giustizia vecchia dalle origini al 1330","1.0","1896.0","-0.2506925712619377","0.49137931034482757","0.4745996452091079","2"
"TO00126457","3.0","Berengo, Marino","7","True","30943","11","True","False","False","0","Milano","IT","ita","L'agricoltura veneta dalla caduta della Repubblica all'Unita","3.0","1963.0","0.11904761904761907","0.8333333333333334","-0.04365079365079372","3"
"TO00300930","3.0","Ruggiero, Guido","10","True","8936","11","True","False","True","0","New York","GB","eng","Binding passions : tales of magic, marriage and power at the end of the Renaissance","3.0","1993.0","0.0","1.0","-0.4861111111111111","1"
"TO00307000","3.0","Lane, Frederic Chapin","27","True","36723","66","True","False","True","0","Baltimore","US","eng","Venice : a maritime republic","3.0","1973.0","0.3042583456917164","0.7510668563300142","-0.471960594413002","1"
"TO00308143","3.0","Goldthwaite, Richard A","9","True","28567","13","True","False","False","0","Baltimore","US","eng","Wealth and the demand for art in Italy : 1300-1600","3.0","1993.0","0.2456575682382135","0.9230769230769231","-0.4193548387096774","1"
"TO00308838","3.0","edited by J. R. Hale","7","True","35452","13","True","False","False","0","London","GB","eng","Renaissance Venice","3.0","1974.0","0.0","0.6","-1.23","1"
"TO00311142","3.0","Finlay, Robert","3","True","33752","28","True","True","True","65","New Brunswick, New Jersey","US","eng","Politics in renaissance Venice","3.0","1980.0","0.11118930330752996","0.6724137931034483","-0.30832160450387047","1"
"TO00311413","3.0","Trexler, Richard C","23","True","23799","11","True","False","False","0","New York","US","eng","Public life in Renaissance Florence","3.0","1980.0","0.0","0.8333333333333334","-0.5416666666666667","1"
"TO00315809","3.0","Weissman, Ronald F. E","16","True","22285","12","True","False","False","0","New York","US","eng","Ritual brotherhood in renaissance Florence","3.0","1982.0","0.07518796992481203","0.7894736842105263","0.0664160401002506","1"
"TO00320793","3.0","Herlihy, David","37","True","32092","15","True","False","False","0","Paris","FR","fre","Les Toscans et leurs familles : une étude du catasto florentin de 1427","3.0","1978.0","0.026162790697674465","0.6511627906976745","-0.7960271317829458","1"
"TO00323589","3.0","Wootton, David","16","True","15298","10","True","False","False","0","Cambridge \etc","GB","eng","Paolo Sarpi between Renaissance and Enlightenment","3.0","1983.0","0.625","1.0","-2.0","1"
"TO00324714","3.0","Berengo, Marino","106","True","9310","61","True","True","True","80","Firenze","IT","ita","La società veneta alla fine del Settecento : ricerche storiche","3.0","1956.0","0.08347618961690462","0.8583106267029973","-0.23600910671214004","1"
"TO00343082","2.0","Edler de Roover, Florence","8","True","32282","12","True","False","False","0","Cambridge, Mass","US","eng","Glossary of mediaeval terms of business: Italian series 1200-1600","2.0","1934.0","0.1777777777777778","0.7777777777777778","-1.2814814814814817","2"
"TO00348156","3.0","Hunecke, Volker","15","True","33091","10","True","True","True","151","Tübingen","DE","ger","Der venezianische Adel am Ende der Republik 1646-1797 : Demographie, Familie, Haushalt","3.0","1995.0","0.11904761904761907","0.8333333333333334","0.08333333333333337","1"
"TO00562026","2.0","Lane, Frederic Chapin","10","True","19234","19","True","False","False","0","Baltimore","GB","eng","Andrea Barbarigo : merchant of Venice","3.0","1944.0","0.14333333333333337","0.56","-1.1191666666666666","2"
"TO00572706","2.0","Maranini, Giuseppe","48","True","26787","21","True","False","False","0","Venezia","IT","ita","La costituzione di Venezia dalle origini alla serrata del maggior consiglio","3.0","1927.0","-0.09960474308300404","0.509090909090909","0.05454545454545445","2"
"TO00633542","3.0","Sansovino, Francesco","9","True","16266","90","True","False","False","0","Venezia","IT","ita","Venetia cittá nobilissima et singolare","1.0","1998.0","0.38120424613839665","0.9447047797563262","-0.7819615635055346","0"
"TO00713451","2.0","Foscarini, Marco","38","True","36033","25","True","False","False","0","Venezia","IT","ita","Della letteratura veneziana ed altri scritti intorno ad essa","3.0","1854.0","0.37997432605905007","0.8536585365853658","-0.49646983311938386","0"
"TO00723667","2.0","Cicogna, Emmanuele Antonio","43","True","3676","64","True","False","False","0","Venezia","IT","ita","Saggio di bibliografia veneziana","2.0","1847.0","0.40274194425478693","0.8355437665782494","-0.662877712186486","0"
"TO00951935","3.0","4: Storia dell'arte italiana","5","True","20471","26","True","False","False","0","Milano","IT","ita","Storia dell'arte italiana","3.0","1992.0","0.5609756097560976","1.0","-1.3424796747967478","0"
"TO00956200","2.0","Mutinelli, Fabio","13","True","8957","24","True","False","False","0","Venezia","IT","ita","Annali urbani di Venezia : dall'anno 810 al 12 maggio 1797","1.0","1841.0","-0.016879886282871404","0.6547619047619048","-0.3246268656716418","0"
"TO01154290","3.0","Goldthwaite, Richard A","3","True","22231","13","True","False","False","0","Baltimore","US","eng","The building of Renaissance Florence : an economic and social history","3.0","1980.0","-0.3560371517027864","0.5263157894736842","0.17801857585139325","1"
"TO01172057","3.0","Lane, Frederic Chapin","2","True","8379","11","True","False","False","0","Paris","FR","fre","Venise : une république maritime","3.0","1985.0","-0.3717948717948718","0.46153846153846156","-0.13461538461538458","2"
"TO01206416","3.0","Ginzburg, Carlo","1","True","36820","22","True","False","False","0","Roma","IT","ita","Voci dal dizionario biografico degli Italiani","2.0","1964.0","0.117528991971454","0.5921052631578947","-0.4124665477252454","1"
"TO01220238","2.0","Selvatico, Pietro","15","True","506","15","True","False","False","0","Venezia [ecc","IT","ita","Guida artistica e storica di Venezia e delle isole circonvicine","2.0","1852.0","0.07692307692307687","1.0","-0.782051282051282","0"
"TO01224436","3.0","Norwich, John Julius","1","True","11125","14","True","False","False","0","New York","US","eng","A history of Venice","3.0","1982.0","0.09999999999999998","0.9","-0.36250000000000004","1"
"TO01344584","2.0","Venezia","9","True","5512","18","True","False","False","0","Venezia","IT","ita","Leggi e memorie venete sulla prostituzione fino alla caduta della Repubblica","1.0","1870.0","0.26944971537001894","0.8870967741935484","-0.6484819734345351","1"
"TO01434319","2.0","Ruskin, John","1","True","30712","11","True","False","False","0","New York","US","eng","The stones of Venice. 1, The foundations","3.0","1851.0","0.4","1.0","-1.2666666666666666","0"
"TO01449798","2.0","Dandolo, Girolamo","1","True","29228","29","True","False","False","0","Venezia","IT","ita","La caduta della Repubblica di Venezia ed i suoi ultimi cinquant'anni : studii storici","3.0","1855.0","0.001766091051805363","0.5306122448979592","-0.5123626373626374","0"
"TO01553970","3.0","Vivian, Frances","1","True","2589","16","True","False","False","0","Vicenza","IT","ita","Il console Smith mercante e collezionista","3.0","1971.0","0.26315789473684215","1.0","-0.8890977443609023","0"
"TO0E004398","1.0","Botero, Giovanni","17","True","31916","12","True","False","False","0","In Venetia","IT","ita","Relatione della republica venetiana, di Giouanni Botero Benese ... Con vn discorso intorno allo stato della Chiesa","1.0","1605.0","0.18894009216589858","0.9032258064516129","-1.1129032258064515","1"
"TO0E005767","1.0","Foscarini, Marco","29","True","2562","17","True","False","False","0","In Padova","IT","ita","Della letteratura veneziana libri otto di Marco Foscarini ... Volume primo","1.0","1752.0","-0.23369565217391308","0.375","0.14565217391304341","0"
"TO0E012564","1.0","Degli Agostini, Giovanni","31","True","7900","15","True","False","False","0","In Venezia","IT","ita","Notizie istorico-critiche intorno la vita, e le opere degli scrittori viniziani. Raccolte, esaminate, e distese da f. Giovanni Degli Agostini ..","3.0","1752.0","-0.10436432637571158","0.4838709677419355","-0.15939278937381407","0"
"TO0E017353","2.0","Cicogna, Emmanuele Antonio","28","True","36050","29","True","False","False","0","Venezia","IT","ita","Delle inscrizioni veneziane raccolte ed illustrate da Emmanuele Antonio Cigogna cittadino veneto. Volume 1. [-6.","2.0","1824.0","0.44655943656609876","0.9022556390977443","-0.4652612544018273","0"
"TO0E129789","1.0","Zompini, Gaetano","2","True","6147","11","True","False","False","0","Venezia","IT","ita","Le arti che vanno per via nella città di Venezia inventate ed incise da Gaetano Zompini. Aggiuntavi una memoria di detto autore","1.0","1785.0","-0.17142857142857143","0.42857142857142855","0.8714285714285717","1"
"TSA0485773","2.0","Schroder, Franz","2","True","25040","13","True","False","False","0","Venezia","IT","ita","Repertorio genealogico delle famiglie confermate nobili e dei titolati nobili esistenti nelle provincie venete : contenente anche le notizie storiche sulla loro origine ..","2.0","1831.0","-0.025000000000000022","0.6","-0.71125","0"
"TSA0579024","3.0","Rubino, Aulo","3","True","34861","12","True","False","False","0","Udine","IT","ita","Aspetti della storia economica friulana dalla fine del 15. secolo alla caduta del dominio veneto","3.0","1961.0","0.0","0.625","0.5","2"
"TSA0723876","2.0","Moschini, Giannantonio","22","True","10147","12","True","False","False","0","Venezia","IT","ita","Dell'incisione in Venezia","3.0","1924.0","0.03448275862068961","1.0","-0.43908045977011495","0"
"UBO0047009","3.0","edited by David Chambers and Brian Pullan","4","True","2331","12","True","False","False","0","Oxford (UK","GB","eng","Venice : a documentary history, 1450-1630","3.0","1992.0","0.028017241379310387","0.9655172413793104","-0.5204741379310345","1"
"UBO0284294","3.0","Ruggiero, Guido","4","True","12006","13","True","False","True","0","New Brunswick","US","eng","Violence in early Renaissance Venice","3.0","1980.0","0.2894736842105263","0.7894736842105263","-0.13596491228070173","1"
"UBO0344202","2.0","Brown, Horatio F","6","True","32179","25","True","False","False","0","London","GB","eng","The venetian printing press : an historical study based upon documents for the most part hitherto unpublished","3.0","1891.0","0.1521255904417893","0.8898305084745762","-0.6246874131703251","1"
"UBO1384890","3.0","Cristinelli, Giuseppe","67","True","15311","11","True","False","False","0","Venezia","IT","ita","Baldassare Longhena : architetto del '600 a Venezia","3.0","1972.0","0.4","1.0","-1.0","0"
"UBO1422179","2.0","Selvatico, Pietro","6","True","19622","18","True","False","False","0","Venezia [etc.","IT","ita","Guida di Venezia e delle isole circonvicine","2.0","1852.0","0.5116279069767442","1.0","-1.127906976744186","0"
"UBO1480961","2.0","Tietze, Hans","4","True","24749","18","True","False","False","0","New York","US","eng","The drawings of the Venetian painters in the 15th and 16th centuries","3.0","1944.0","0.22460859092733843","0.9905660377358491","-0.9010437575270976","0"
"UBO1481061","2.0","Hill, George Francis","7","True","36550","12","True","False","False","0","London","GB","eng","A corpus of Italian medals of the Renaissance before Cellini","3.0","1930.0","0.2222222222222222","1.0","-0.8629629629629629","0"
"UBO1589423","2.0","Battaglini, Nicolo","16","True","22660","11","True","False","False","0","Venezia","IT","ita","Torcello antica e moderna : studii","3.0","1871.0","0.16346153846153844","0.625","-0.05048076923076916","0"
"UBO1595712","2.0","Gabelentz, Hans : von der","4","True","25809","11","True","False","False","0","Leipzig","DE","ger","Mittelalterliche Plastik in Venedig","3.0","1903.0","0.1962864721485411","0.9655172413793104","-1.070291777188329","0"
"UBO1611390","2.0","Planiscig, Leo","14","True","10079","18","True","False","False","0","Wien","AT","ger","Venezianische bildhauer der Renaissance","3.0","1921.0","0.5161290322580645","1.0","-1.4838709677419355","0"
"UBO1781965","3.0","Panofsky, Erwin","2","True","24803","12","True","False","False","0","New York","US","eng","Problems in Titian, mostly iconographic","3.0","1969.0","0.3149905123339658","0.9032258064516129","-0.7011385199240986","0"
"UBO2846345","2.0","Berenson, Bernard","1","True","1624","11","True","False","False","0","New York","US","eng","The venetian painters of the Renaissance : with an index to their works","3.0","1894.0","0.375","1.0","-1.2013888888888888","0"
"UBO3801993","3.0","","5","True","2915","12","True","False","False","0","Roma","IT","ita","Dizionario biografico degli italiani : [presentazione dell'opera","2.0","1960.0","-0.2517647058823529","0.5882352941176471","0.7411764705882353","1"
"UBO3888338","2.0","Molmenti, Pompeo","1","True","36520","12","True","False","False","0","Venezia","IT","ita","Calli e canali in Venezia","3.0","1893.0","0.16666666666666663","1.0","-0.5416666666666666","0"
"UBOE000104","1.0","Sansovino, Francesco","58","True","785","59","True","False","False","0","In Venetia","IT","ita","Venetia citta nobilissima et singolare, descritta in 14. libri da M. Francesco Sansouino. Nella quale si contengono tutte le guerre passate, con l'attioni illustri di molti senatori. Le vite dei principi, & gli scrittori veneti del tempo loro. Le chiese, fabriche, edifici, & palazzi publichi, & priuati. Le leggi, gli ordini, & gli vsi antichi & moderni, con altre cose appresso notabili, & degne di memoria","1.0","1581.0","0.30918710918710923","0.9663299663299664","-0.6691358024691358","0"
"UFI0018284","3.0","Concina, Ennio","4","True","6489","34","True","False","False","0","Venezia","IT","ita","Venezia nell'eta moderna : struttura e funzioni","3.0","1989.0","-0.051948051948051965","0.6623376623376623","-0.32738095238095233","0"
"UFI0066154","3.0","McAndrew, John","21","True","8335","27","True","False","False","0","Cambridge, Massachusettes","US","eng","Venetian architecture of the early Renaissance","3.0","1980.0","0.044620091789903116","0.9905660377358491","-0.4452022777494475","0"
"UFI0179742","2.0","Hill, George","21","True","22498","12","True","False","False","0","Cambridge","GB","eng","A history of Cyprus","3.0","1949.0","-0.4117647058823529","0.5882352941176471","0.7148692810457516","2"
"UFI0200444","3.0","Massari, Antonio","79","True","17081","16","True","False","False","0","Vicenza","IT","ita","Giorgio Massari : architetto veneziano del Settecento","3.0","1971.0","0.19999999999999996","1.0","-1.0571428571428572","0"
"UFI0257758","2.0","Molmenti, Pompeo","37","True","25316","24","True","False","False","0","Bologna","IT","ita","Curiosità di storia veneziana","3.0","1919.0","0.13875598086124408","0.6842105263157895","-0.4792663476874003","1"
"UFI0262573","2.0","Sardella, Pierre","19","True","12277","19","True","False","False","0","Paris","FR","fre","Nouvelles et speculations a Venise au debut du 16. siecle","3.0","1948.0","0.06417112299465233","0.6818181818181818","-0.8079322638146167","1"
"UM10040637","2.0","Cicognara, Leopoldo","23","True","17774","20","True","False","False","0","Venezia","IT","ita","Le fabbriche e i monumenti cospicui di Venezia","3.0","","0.4285714285714286","1.0","-0.7844387755102041","0"
"UMC0042800","3.0","Venezia : Senato","32","True","23929","17","True","False","False","0","Venezia","IT","ita","Le deliberazioni del Consiglio dei Rogati, Senato : Serie Mixtorum","1.0","1960.0","0.13058823529411767","0.9705882352941176","-1.1376470588235295","2"
"UMC0316124","3.0","Venezia","13","True","32558","16","True","False","False","0","Bologna","IT","ita","Deliberazioni del Maggior Consiglio di Venezia","1.0","1970.0","0.4653846153846154","0.8653846153846154","-1.006153846153846","2"
"UMC0381454","3.0","Pullan, Brian","2","True","8228","17","True","False","False","0","Cambridge (Mass","GB","eng","Rich and poor in Renaissance Venice : the social institutions of a catholic State, to 1620","3.0","1971.0","0.22077922077922074","0.8571428571428571","-0.38636363636363646","1"
"UTO0908099","2.0","Simonsfeld, Henry","4","True","1468","31","True","False","False","0","Stuttgart","DE","ger","Der Fondaco dei Tedeschi in Venedig und die Deutsch-Venetianischen Handelsbeziehungen : eine historische Skizze","3.0","1887.0","-0.20918492982024134","0.4198473282442748","-0.03909135680866771","0"
